{
  "created": "1970-01-01T12:00:00Z",
  "updated": "1970-01-01T12:00:00Z",
  "name": "ssh",
  "enabled": true,
  "precedence": false,
  "action": "allow",
  "duration": "always",
  "operator": {
    "type": "simple",
    "operand": "process.path",
    "sensitive": false,
    "data": "/usr/bin/ssh",
    "list": null
  }
}
