{
  "created": "1970-01-01T12:00:00Z",
  "updated": "1970-01-01T12:00:00Z",
  "name": "pasta",
  "description": "",
  "action": "allow",
  "duration": "always",
  "operator": {
    "operand": "process.path",
    "data": "/usr/bin/pasta.avx2",
    "type": "simple",
    "list": [],
    "sensitive": false
  },
  "enabled": true,
  "precedence": false,
  "nolog": false
}
