{
  "created": "1970-01-01T12:00:00Z",
  "updated": "1970-01-01T12:00:00Z",
  "name": "00-chromium",
  "enabled": true,
  "precedence": false,
  "action": "allow",
  "duration": "always",
  "operator": {
    "type": "list",
    "operand": "list",
    "list": [
      {
        "type": "simple",
        "operand": "process.path",
        "sensitive": false,
        "data": "/usr/lib/chromium/chromium",
        "list": null
      },
      {
        "type": "regexp",
        "operand": "dest.port",
        "sensitive": false,
        "data": "53|80|443",
        "list": null
      }
    ]
  }
}
