{
  "created": "1970-01-01T12:00:00Z",
  "updated": "1970-01-01T12:00:00Z",
  "name": "josm",
  "enabled": true,
  "precedence": false,
  "action": "allow",
  "duration": "always",
  "operator": {
    "type": "list",
    "operand": "list",
    "sensitive": false,
    "list": [
      {
        "type": "simple",
        "operand": "process.command",
        "sensitive": false,
        "data": "/bin/java -Djosm.restart=true -Djava.net.useSystemProxies=true -jar /usr/share/josm/josm.jar",
        "list": null
      },
      {
        "type": "lists",
        "operand": "lists.domains",
        "sensitive": false,
        "data": "/etc/opensnitchd/lists/josm",
        "list": null
      }
    ]
  }
}
