{
  "created": "1970-01-01T12:00:00Z",
  "updated": "1970-01-01T12:00:00Z",
  "name": "kilocode",
  "description": "",
  "action": "allow",
  "duration": "always",
  "operator": {
    "operand": "list",
    "data": "",
    "type": "list",
    "list": [
      {
        "operand": "dest.ip",
        "data": "127.0.0.1",
        "type": "simple",
        "list": null,
        "sensitive": false
      },
      {
        "operand": "dest.port",
        "data": "20128",
        "type": "simple",
        "list": null,
        "sensitive": false
      },
      {
        "operand": "process.path",
        "data": "$HOME/\\.vscode-oss/extensions/kilocode\\.kilo-code-[0-9.]+-linux-x64/bin/kilo",
        "type": "regexp",
        "list": null,
        "sensitive": false
      }
    ],
    "sensitive": false
  },
  "enabled": true,
  "precedence": false,
  "nolog": false
}
