{
  "created": "1970-01-01T12:00:00Z",
  "updated": "1970-01-01T12:00:00Z",
  "name": "host",
  "enabled": true,
  "precedence": true,
  "action": "allow",
  "duration": "always",
  "operator": {
    "type": "list",
    "operand": "list",
    "sensitive": false,
    "list": [
      {
        "type": "simple",
        "operand": "process.path",
        "sensitive": false,
        "data": "/usr/bin/host",
        "list": null
      },
      {
        "type": "simple",
        "operand": "dest.port",
        "sensitive": false,
        "data": "53",
        "list": null
      },
      {
        "type": "lists",
        "operand": "lists.nets",
        "sensitive": false,
        "data": "/etc/opensnitchd/lists/localhost",
        "list": null
      }
    ]
  }

}
