{
  "created": "1970-01-01T12:00:00Z",
  "updated": "1970-01-01T12:00:00Z",
  "name": "docker-proxy",
  "description": "",
  "action": "allow",
  "duration": "always",
  "operator": {
    "operand": "list",
    "data": "",
    "type": "list",
    "list": [
      {
        "operand": "dest.network",
        "data": "172.17.0.0/24",
        "type": "network",
        "list": null,
        "sensitive": false
      },
      {
        "operand": "process.path",
        "data": "/usr/bin/docker-proxy",
        "type": "simple",
        "list": null,
        "sensitive": false
      }
    ],
    "sensitive": false
  },
  "enabled": true,
  "precedence": false,
  "nolog": false
}
