{
  "created": "1970-01-01T12:00:00Z",
  "updated": "1970-01-01T12:00:00Z",
  "name": "00-firefox",
  "enabled": true,
  "precedence": false,
  "action": "allow",
  "duration": "always",
  "operator": {
    "type": "simple",
    "operand": "process.path",
    "sensitive": false,
    "data": "/usr/lib/firefox-esr/firefox-esr",
    "list": []
  }
}
