{
  "created": "1970-01-01T12:00:00Z",
  "updated": "1970-01-01T12:00:00Z",
  "name": "00-unbound",
  "enabled": true,
  "precedence": false,
  "action": "allow",
  "duration": "always",
  "operator": {
    "type": "list",
    "operand": "list",
    "sensitive": false,
    "list": [
      {
        "type": "simple",
        "operand": "process.path",
        "sensitive": false,
        "data": "/usr/sbin/unbound",
        "list": null
      },
      {
        "type": "simple",
        "operand": "dest.port",
        "sensitive": false,
        "data": "8053",
        "list": null
      },
      {
        "type": "lists",
        "operand": "lists.nets",
        "sensitive": false,
        "data": "/etc/opensnitchd/lists/localhost",
        "list": null
      }
    ]
  }
}
